{
  "schemaVersion": "1.1.0",
  "catalogId": "sample-fpv-001",
  "meta": {
    "name": "Sample COTS FPV Catalog",
    "description": "Realistic off-the-shelf FPV / small-UAS hardware catalog. Flight controllers, ESCs, motors, batteries, VTXes with switchable power levels, ELRS TX/RX, goggles, and GPS modules that operators actually field. Demonstrates the full engine stack: physics and compatibility validation, operator-drone link budget, EMCON footprint, density-altitude derating, and sustainment math.",
    "unit": "Sample / Demo",
    "lastUpdated": "2026-04-21T04:40:36.153848+00:00",
    "inventoryReference": "SAMPLE-FPV-001"
  },
  "airframes": [
    {
      "id": "airframe-5in-true-x",
      "name": "5\" True-X Freestyle Frame (TBS Source One / Armattan / equivalent)",
      "type": "multi-rotor",
      "weight_g": 95,
      "max_payload_g": 800,
      "dimensions_mm": {
        "length": 220,
        "width": 220,
        "height": 45
      },
      "motor_count": 4,
      "motor_size": "2207",
      "prop_size": "5x4.3",
      "material": "carbon fiber",
      "printable": false,
      "manufacturer": "TBS / Armattan / ImpulseRC (generic spec)",
      "part_number": "FRAME-5IN-TRUEX",
      "cost_usd": 45.0,
      "availability": "in-stock",
      "notes": "Workhorse 5\" true-X frame with 4mm carbon arms and 30.5×30.5 FC mount.",
      "tags": [
        "5-inch",
        "freestyle",
        "race",
        "true-x"
      ]
    },
    {
      "id": "airframe-7in-longrange",
      "name": "7\" Long-Range Frame (iFlight Chimera7 / equivalent)",
      "type": "multi-rotor",
      "weight_g": 180,
      "max_payload_g": 1500,
      "dimensions_mm": {
        "length": 300,
        "width": 300,
        "height": 50
      },
      "motor_count": 4,
      "motor_size": "2806",
      "prop_size": "7x3.5",
      "material": "carbon fiber",
      "printable": false,
      "manufacturer": "iFlight / GEPRC",
      "part_number": "FRAME-7IN-LR",
      "cost_usd": 89.0,
      "availability": "in-stock",
      "notes": "Long-range 7\" with room for HD VTX, GPS, and higher-capacity packs.",
      "tags": [
        "7-inch",
        "long-range",
        "cruise"
      ]
    },
    {
      "id": "airframe-10in-isr",
      "name": "10\" ISR/Cargo X-Frame (MultiRotorMania Dragonfly / equivalent)",
      "type": "multi-rotor",
      "weight_g": 340,
      "max_payload_g": 3000,
      "dimensions_mm": {
        "length": 440,
        "width": 440,
        "height": 70
      },
      "motor_count": 4,
      "motor_size": "3110",
      "prop_size": "10x5x3",
      "material": "carbon fiber",
      "printable": false,
      "manufacturer": "MultiRotorMania / iFlight / Armattan",
      "part_number": "FRAME-10IN-ISR",
      "cost_usd": 135.0,
      "availability": "in-stock",
      "notes": "10\" X-frame for ISR / thermal / heavy-lift builds. Supports long-range link and higher-capacity packs.",
      "tags": [
        "10-inch",
        "isr",
        "cargo",
        "cruise"
      ]
    },
    {
      "id": "airframe-fw-660",
      "name": "Fixed-Wing 660mm Pusher (Volantex Raptor / Sonicmodell / equivalent)",
      "type": "fixed-wing",
      "weight_g": 420,
      "max_payload_g": 800,
      "dimensions_mm": {
        "length": 760,
        "width": 660,
        "height": 190
      },
      "motor_count": 1,
      "motor_size": "2212",
      "prop_size": "9x6",
      "material": "EPO foam",
      "printable": false,
      "manufacturer": "Volantex / Sonicmodell",
      "part_number": "FRAME-FW-660",
      "cost_usd": 95.0,
      "availability": "in-stock",
      "notes": "Compact fixed-wing with pusher config — 60+ min endurance on Li-ion.",
      "tags": [
        "fixed-wing",
        "endurance",
        "foam",
        "pusher"
      ]
    },
    {
      "id": "airframe-fw-flying-wing",
      "name": "1900mm Flying-Wing (Skywalker X8 / Z84 / equivalent)",
      "type": "fixed-wing",
      "weight_g": 880,
      "max_payload_g": 2000,
      "dimensions_mm": {
        "length": 1200,
        "width": 2120,
        "height": 210
      },
      "motor_count": 1,
      "motor_size": "3536",
      "prop_size": "13x8",
      "material": "EPO foam",
      "printable": false,
      "manufacturer": "Skywalker / Sonicmodell",
      "part_number": "FRAME-FW-FLYING-WING",
      "cost_usd": 185.0,
      "availability": "in-stock",
      "notes": "Flying-wing platform for 2+ hour ISR endurance with Li-ion.",
      "tags": [
        "fixed-wing",
        "flying-wing",
        "long-endurance",
        "isr"
      ]
    }
  ],
  "motors": [
    {
      "id": "motor-emax-eco-ii-2807-1300kv",
      "name": "EMAX ECO II 2807 1300KV",
      "size": "2807",
      "kv": 1300,
      "weight_g": 34,
      "max_current_a": 36,
      "max_power_w": 800,
      "max_thrust_g": 2200,
      "voltage_range": {
        "min_v": 11.1,
        "max_v": 22.2
      },
      "prop_size_range": "7 inch",
      "manufacturer": "EMAX",
      "part_number": "ECO-II-2807-1300KV",
      "cost_usd": 18.99,
      "availability": "in-stock",
      "notes": "1300KV is low for 5\" 6S; best matched to 7\" cruise or fixed-wing pusher/puller configurations.",
      "tags": [
        "multi-rotor",
        "7-inch",
        "fixed-wing-pusher",
        "overstocked"
      ]
    },
    {
      "id": "motor-rcinpower-gts-v4-2207-1960kv",
      "name": "RCInPower GTS V4 2207 1960KV",
      "size": "2207",
      "kv": 1960,
      "weight_g": 32,
      "max_current_a": 40,
      "max_power_w": 880,
      "max_thrust_g": 1900,
      "voltage_range": {
        "min_v": 14.8,
        "max_v": 25.2
      },
      "prop_size_range": "5 inch",
      "manufacturer": "RCInPower",
      "part_number": "GTS-V4-2207-1960KV",
      "cost_usd": 29.99,
      "availability": "in-stock",
      "notes": "Limited stock; substitute Axisflying AF227 (on order) required for full 5\" fleet build.",
      "tags": [
        "multi-rotor",
        "5-inch",
        "6s",
        "low-stock"
      ]
    },
    {
      "id": "motor-avenger-3110-730kv",
      "name": "Avenger 3110 730KV (generic)",
      "size": "3110",
      "kv": 730,
      "weight_g": 85,
      "max_current_a": 45,
      "max_power_w": 1000,
      "max_thrust_g": 3500,
      "voltage_range": {
        "min_v": 14.8,
        "max_v": 25.2
      },
      "prop_size_range": "10 inch",
      "manufacturer": "Generic (Amazon YJhGFqS)",
      "part_number": "AVENGER-3110-730KV",
      "cost_usd": 24.99,
      "availability": "in-stock",
      "notes": "Generic Amazon rebrand, no official datasheet. QC varies unit-to-unit — inspect for smooth rotation and bell balance before install.",
      "tags": [
        "multi-rotor",
        "10-inch",
        "6s",
        "generic-amazon"
      ]
    }
  ],
  "escs": [
    {
      "id": "esc-holybro-tekko32-f4-metal-65a",
      "name": "Holybro Tekko32 F4 Metal 65A 4-in-1 ESC",
      "max_current_a": 65,
      "weight_g": 18,
      "voltage_range": {
        "min_v": 11.1,
        "max_v": 25.2
      },
      "firmware": "AM32 (or BLHeli_32 on older units)",
      "protocols": [
        "DShot600",
        "DShot300",
        "BLHeli_32"
      ],
      "integrated": true,
      "manufacturer": "Holybro",
      "part_number": "31097",
      "cost_usd": 112.0,
      "availability": "in-stock",
      "notes": "65A continuous, 80A burst 10s. Pairs with Kakute H7 V2 via 8-pin JST-SH factory ribbon.",
      "tags": [
        "multi-rotor",
        "10-inch",
        "4-in-1",
        "am32",
        "stack-pair-kakute-h7"
      ],
      "firmware_family": "BetaFlight",
      "connectors": [
        {
          "type": "JST-SH",
          "pins": 8,
          "label": "FC Signal",
          "notes": "Motor signals + telemetry to Kakute H7 BT"
        },
        {
          "type": "Solder Pad",
          "pins": 4,
          "label": "Motor Out"
        },
        {
          "type": "Battery",
          "pins": 2,
          "label": "VBAT",
          "notes": "Solder pads, 3S-6S input"
        }
      ]
    },
    {
      "id": "esc-speedybee-60a-blheli-s",
      "name": "SpeedyBee 60A BLHeli_S 4-in-1 ESC (30x30)",
      "max_current_a": 60,
      "weight_g": 14,
      "voltage_range": {
        "min_v": 11.1,
        "max_v": 25.2
      },
      "firmware": "BLHeli_S J-H-40",
      "protocols": [
        "DShot600",
        "DShot300"
      ],
      "integrated": true,
      "manufacturer": "SpeedyBee",
      "part_number": "SB-F405V4-60A-ESC",
      "cost_usd": 55.0,
      "availability": "in-stock",
      "notes": "BLHeli_S = no bidirectional DShot out-of-box; reflash with BlueJay for RPM filtering.",
      "tags": [
        "multi-rotor",
        "5-inch",
        "4-in-1",
        "blheli-s",
        "stack-pair-speedybee-f405"
      ],
      "firmware_family": "BetaFlight",
      "connectors": [
        {
          "type": "JST-SH",
          "pins": 8,
          "label": "FC Signal",
          "notes": "Motor signals to SpeedyBee F405 V4"
        },
        {
          "type": "Solder Pad",
          "pins": 4,
          "label": "Motor Out"
        }
      ]
    },
    {
      "id": "esc-lumenier-51a-blheli-32",
      "name": "Lumenier 51A BLHeli_32 Single ESC (w/ Telemetry)",
      "max_current_a": 51,
      "weight_g": 15,
      "voltage_range": {
        "min_v": 7.4,
        "max_v": 25.2
      },
      "firmware": "BLHeli_32 (locked, post-EOL)",
      "protocols": [
        "DShot1200",
        "DShot600",
        "PWM",
        "OneShot"
      ],
      "integrated": false,
      "manufacturer": "Lumenier",
      "part_number": "680138770916",
      "cost_usd": 32.0,
      "availability": "in-stock",
      "notes": "Single ESC for fixed-wing use with F405-WING V2. BLHeli_32 is locked/unflashable post-EOL — stock settings work for fixed-wing.",
      "tags": [
        "fixed-wing",
        "single-motor",
        "blheli-32",
        "with-telemetry"
      ],